{
  "age": {
    "25_34": true
  },
  "origin": {
    "other": true
  },
  "education": {
    "high_school_graduate_or_equivalent": true
  },
  "gender": {
    "decline": true
  },
  "income": {
    "25000_49999": true
  },
  "races": {
    "black_or_african_american": true,
    "native_hawaiian": true
  }
}
